{
  "request_id": "REQ-001",
  "graph_id": "GRAPH-20261029-D4E5F6",
  "from_instance": "inst-A",
  "to_instance": "inst-B",
  "mode": "read",
  "graph_version": "gv2",
  "units": [
    { "unit_id": "UNIT-001", "kind": "evidence", "status": "confirmed", "scope": "shareable", "graph_version": "gv2" },
    { "unit_id": "UNIT-002", "kind": "decision", "status": "confirmed", "scope": "shareable", "graph_version": "gv2" }
  ]
}
