{
  "request_id": "REQ-002",
  "graph_id": "GRAPH-20261029-D4E5F6",
  "from_instance": "inst-A",
  "to_instance": "inst-B",
  "mode": "read",
  "graph_version": "gv2",
  "units": [
    { "unit_id": "UNIT-010", "kind": "evidence", "status": "confirmed", "scope": "private", "graph_version": "gv2" }
  ]
}
